{
  "apiVersion": "ahra.dev/v1alpha1",
  "kind": "PlanDraft",
  "metadata": {
    "goalId": "GOAL-M1-GENERIC-SMOKE",
    "proposedBy": "planner/agent-driver-plan-draft@sha256:868b6967bf3f8d448634a0a79ab14661089ebcc1f08b969c1f2054deb75929db"
  },
  "spec": {
    "nodes": [
      {
        "budgetRequest": {
          "maxCostUsd": 0.0,
          "maxModelCalls": 1,
          "maxSpawnedNodes": 0,
          "maxToolCalls": 1,
          "maxWallSeconds": 60
        },
        "capabilityRequests": [],
        "claimRefs": [
          "CLM-WRITE-ARTIFACT"
        ],
        "dependsOn": [],
        "expectedOutputs": [
          {
            "artifactRequired": true,
            "consumerNodeRefs": [
              "NODE-goal-verification"
            ],
            "deliveryRole": "artifact",
            "name": "deterministic-artifact",
            "schemaRef": "planner-output-contracts"
          }
        ],
        "gateRefs": [
          "GATE-write-artifact"
        ],
        "id": "NODE-write-artifact",
        "inputRefs": [
          "GOAL-M1-GENERIC-SMOKE",
          "profile/m1-real-planner@sha256:ffffffffffffffffffffffffffffffffffffffffffffffffffffffffffffffff"
        ],
        "nodeType": "bounded_task",
        "objective": "Produce the bounded artifact required for the generic smoke goal under the write-artifact gate.",
        "retryPolicy": {
          "idempotencyKeyRequired": true,
          "maxAttempts": 1,
          "retryableFailureClasses": []
        },
        "runtimeRef": "runtime/local-goal@sha256:eeeeeeeeeeeeeeeeeeeeeeeeeeeeeeeeeeeeeeeeeeeeeeeeeeeeeeeeeeeeeeee",
        "sideEffect": "idempotent",
        "terminalGoalVerification": false,
        "timeoutSeconds": 60
      },
      {
        "budgetRequest": {
          "maxCostUsd": 0.0,
          "maxModelCalls": 1,
          "maxSpawnedNodes": 0,
          "maxToolCalls": 1,
          "maxWallSeconds": 60
        },
        "capabilityRequests": [],
        "claimRefs": [
          "CLM-GOAL-COMPLETE",
          "CLM-WRITE-ARTIFACT"
        ],
        "dependsOn": [
          "NODE-write-artifact"
        ],
        "expectedOutputs": [],
        "gateRefs": [
          "GATE-goal-complete"
        ],
        "id": "NODE-goal-verification",
        "inputRefs": [
          "NODE-write-artifact"
        ],
        "nodeType": "goal_verification",
        "objective": "Verify that the write-artifact claim satisfies the generic smoke goal completion claim using the supplied goal-complete gate.",
        "retryPolicy": {
          "idempotencyKeyRequired": false,
          "maxAttempts": 1,
          "retryableFailureClasses": []
        },
        "runtimeRef": "runtime/local-goal@sha256:eeeeeeeeeeeeeeeeeeeeeeeeeeeeeeeeeeeeeeeeeeeeeeeeeeeeeeeeeeeeeeee",
        "sideEffect": "idempotent",
        "terminalGoalVerification": true,
        "timeoutSeconds": 60
      }
    ],
    "rationale": "Use the supplied bounded artifact claim followed by terminal goal verification. No capability request is granted because the runtime payload supplies no capability refs."
  }
}
