{
  "apiVersion": "ahra.dev/v1alpha1",
  "kind": "PlanDraft",
  "metadata": {
    "goalId": "GOAL-M1-GENERIC-SMOKE",
    "proposedBy": "planner/agent-driver@sha256:868b6967bf3f8d448634a0a79ab14661089ebcc1f08b969c1f2054deb75929db"
  },
  "spec": {
    "nodes": [
      {
        "budgetRequest": {
          "maxCostUsd": 0.0,
          "maxModelCalls": 1,
          "maxSpawnedNodes": 0,
          "maxToolCalls": 1,
          "maxWallSeconds": 60
        },
        "capabilityRequests": [
          {
            "capability": "filesystem.write",
            "resources": [
              "outputs/summary.txt"
            ]
          }
        ],
        "claimRefs": [
          "CLM-WRITE-ARTIFACT"
        ],
        "dependsOn": [],
        "expectedOutputs": [
          {
            "artifactRequired": true,
            "consumerNodeRefs": [
              "NODE-goal-verification"
            ],
            "deliveryRole": "artifact",
            "name": "deterministic-smoke-artifact",
            "schemaRef": "planner-output-contracts"
          }
        ],
        "gateRefs": [
          "GATE-write-artifact"
        ],
        "id": "NODE-write-artifact",
        "inputRefs": [
          "GOAL-M1-GENERIC-SMOKE",
          "profile/m1-real-combined@sha256:8888888888888888888888888888888888888888888888888888888888888888"
        ],
        "nodeType": "bounded_task",
        "objective": "Create the required deterministic smoke artifact within the governed workspace.",
        "retryPolicy": {
          "idempotencyKeyRequired": true,
          "maxAttempts": 1,
          "retryableFailureClasses": []
        },
        "runtimeRef": "runtime/local-goal@sha256:eeeeeeeeeeeeeeeeeeeeeeeeeeeeeeeeeeeeeeeeeeeeeeeeeeeeeeeeeeeeeeee",
        "sideEffect": "idempotent",
        "terminalGoalVerification": false,
        "timeoutSeconds": 60
      },
      {
        "budgetRequest": {
          "maxCostUsd": 0.0,
          "maxModelCalls": 1,
          "maxSpawnedNodes": 0,
          "maxToolCalls": 1,
          "maxWallSeconds": 60
        },
        "capabilityRequests": [],
        "claimRefs": [
          "CLM-GOAL-COMPLETE",
          "CLM-WRITE-ARTIFACT"
        ],
        "dependsOn": [
          "NODE-write-artifact"
        ],
        "expectedOutputs": [],
        "gateRefs": [
          "GATE-goal-complete"
        ],
        "id": "NODE-goal-verification",
        "inputRefs": [
          "GOAL-M1-GENERIC-SMOKE",
          "NODE-write-artifact"
        ],
        "nodeType": "goal_verification",
        "objective": "Verify the goal-complete claim using the artifact evidence from the bounded write step.",
        "retryPolicy": {
          "idempotencyKeyRequired": false,
          "maxAttempts": 1,
          "retryableFailureClasses": []
        },
        "runtimeRef": "runtime/local-goal@sha256:eeeeeeeeeeeeeeeeeeeeeeeeeeeeeeeeeeeeeeeeeeeeeeeeeeeeeeeeeeeeeeee",
        "sideEffect": "idempotent",
        "terminalGoalVerification": true,
        "timeoutSeconds": 60
      }
    ],
    "rationale": "Propose one bounded write step for the smoke artifact, followed by terminal goal verification against the supplied goal-complete gate."
  }
}
